Código,Nombre,Descripción,Tipo de Producto,Estado,Unidad de Medida,Categoría,Subcategoría,Marca,Peso (kg),Dimensiones,Precio de Compra,Precio de Venta,Precio Mínimo de Venta,Precio Sugerido,Categoría de Impuesto,Tasa de Impuesto (%),Maneja Inventario,Stock Actual,Stock Mínimo,Stock Máximo,Punto de Reorden,Código de Barras,SKU,Referencia Interna,Referencia del Proveedor,Notas,Referencia Externa
PRD-001,Laptop Dell Inspiron 15,Laptop para oficina con procesador Intel i5 8GB RAM 512GB SSD,product,active,unit,Tecnología,Computadores,Dell,2.5,35x25x2 cm,2800000.00,3500000.00,3200000.00,3800000.00,STANDARD_RATE,19.00,true,50.00,10.00,100.00,15.00,7701234567890,DELL-INSP-15,LAP-DELL-001,SUP-DELL-001,Laptop empresarial ideal para trabajo de oficina,REF-EXT-001
SRV-001,Consultoría en Sistemas,Servicio de consultoría técnica especializada en desarrollo de software,service,active,hour,Servicios,Consultoría,Interna,0.0,,0.00,150000.00,120000.00,180000.00,STANDARD_RATE,19.00,false,0.00,0.00,0.00,0.00,,CONS-SIS-001,SRV-CONS-001,,Servicio de consultoría especializada en sistemas,
MIX-001,Kit de Mantenimiento,Kit completo de mantenimiento preventivo para equipos de oficina,both,active,kit,Mantenimiento,Servicios Técnicos,Genérica,1.2,20x15x8 cm,45000.00,75000.00,65000.00,85000.00,REDUCED_RATE,5.00,true,25.00,5.00,50.00,10.00,7701234567899,KIT-MANT-001,KIT-001,SUP-MANT-001,Kit completo para mantenimiento preventivo,REF-EXT-002
PRD-002,Mouse Inalámbrico Logitech,Mouse inalámbrico ergonómico con receptor USB,product,active,unit,Tecnología,Periféricos,Logitech,0.15,12x8x4 cm,35000.00,65000.00,55000.00,75000.00,STANDARD_RATE,19.00,true,100.00,20.00,200.00,30.00,7701234567801,LOG-MX-001,MOU-LOG-001,SUP-LOG-001,Mouse ideal para trabajo de oficina,REF-EXT-003
PRD-003,Papel Bond Tamaño Carta,Resma de papel bond blanco tamaño carta 75g,product,active,pack,Papelería,Papel,Reprograf,2.5,22x28x5 cm,8500.00,15000.00,12000.00,18000.00,EXEMPT,0.00,true,500.00,50.00,1000.00,100.00,7701234567812,PAP-BOND-001,PAP-001,SUP-PAP-001,Papel de alta calidad para impresión,REF-EXT-004
SRV-002,Mantenimiento Preventivo,Servicio de mantenimiento preventivo para equipos de cómputo,service,active,hour,Servicios,Mantenimiento,Interna,0.0,,0.00,80000.00,65000.00,95000.00,STANDARD_RATE,19.00,false,0.00,0.00,0.00,0.00,,MANT-PREV-001,SRV-MANT-001,,Mantenimiento especializado con garantía,
PRD-004,Teclado Mecánico RGB,Teclado mecánico gaming con retroiluminación RGB,product,active,unit,Tecnología,Periféricos,Corsair,1.2,45x15x4 cm,320000.00,580000.00,480000.00,650000.00,STANDARD_RATE,19.00,true,30.00,5.00,60.00,10.00,7701234567823,COR-TEC-001,TEC-COR-001,SUP-COR-001,Teclado profesional para gaming y oficina,REF-EXT-005
